Item Name;Region;Lore;DescriptionGame;DescriptionLore;ImageURL
Cull;noxus;Favored by ambitious Noxian aspirants, each strike is a calculated risk, a chance to rise through the ranks by any means necessary.;Grants gold on hit and bonus gold upon reaching 100 stacks, sacrificing the item.;A pact with a lesser greed spirit. For each foe struck, gain 1 silver. Once 100 silver is earned, the spirit consumes the item, granting the wielder a gem worth 300 silver.;https://wiki.leagueoflegends.com/en-us/images/Cull_item.png
Time Chain;celestial;Associated with the celestial realm of Targon, possibly used by mortals blessed with celestial power or even the Aspects themselves.;Grants a shield after dealing champion damage, preventing damage.;The Time Chain has two ends. As an action, choose two targets to chain. The targets must make a DC 25 Wisdom save or be tethered by time. If either succeeds the save, neither are tethered. When you are able to tether two creatures, they're bound through the celestial realm and the chain disappears from the material plane, existing as a tether in the celestial realm. While a creature is bound, it cannot die if the other creature is alive. All magic performed by a bound creature is felt by its tethered partner, that can choose to immediately dispell it at any point during the duration of the magical effect.;https://wiki.leagueoflegends.com/en-us/images/LeBlanc_Ethereal_Chains_HD.png
Dark Seal;noxus;Commonly used by ambitious Noxian mages, seeking to amplify their power through dark pacts and esoteric knowledge.;Grants Ability Power and Mana. Stacks bonus Ability Power on champion kill or assist. Loses stacks on death.;Wearer gains +1 to cast spells, maximum +10. On a kill, gain +2 temporary hp. Upon death, lose all bonuses and suffer -1 to hit for 1d4 turns.;https://wiki.leagueoflegends.com/en-us/images/Dark_Seal_item.png
Doran's Blade;demacia;Favored by novice duelists in Demacia, it is a simple but effective blade. Used often by young soldiers in training exercises.;Provides attack damage, health, and lifesteal, enhancing early-game combat.;Grants +1 to hit, +1 to damage. On a critical hit, heal 1d4 hit points. Breaks if wielder is reduced to 0 hit points in a single blow.;https://wiki.leagueoflegends.com/en-us/images/Doran%27s_Blade_item.png
Doran's Shield;demacia;Commonly used by Demacian soldiers, its protective qualities are well-regarded. Some suspect Galio's magic is infused, granting the bearer tenacity.;Grants health, health regeneration, and damage reduction from champion attacks.;Wearer gains +8 hit points and regenerates 1 hit point per turn. Reduce damage from targeted attacks by 1, stacks up to 2 times. Shield Crumbles if wearer is Evil Alignment.;https://wiki.leagueoflegends.com/en-us/images/Doran%27s_Shield_item.png
Guardian's Hammer;freljord;Forged in the icy heart of the Freljord, it whispers tales of forgotten iceborn warriors and their relentless battles against the void.;+150 Health, +10 Attack Damage, 10% Life Steal.;Wearer gains +1 to hit when HP is below 50%. Whenever you deal the killing blow on an enemy, heal 1d4 HP.;https://wiki.leagueoflegends.com/en-us/images/Guardian%27s_Hammer_item.png
Guardian's Orb;ionia;This orb may be tied to ancient Ionian spirit magic, possibly used to protect against malevolent entities or channel inner power.;Grants ability power, health, and mana. Taking damage grants a shield.;Wearer gains +2 to saves versus magical attacks. If damage would reduce the wearer to 0 hit points or less, they are instead reduced to 1d4 hit points and gain temporary AC 18 for 1 round.;https://wiki.leagueoflegends.com/en-us/images/Guardian%27s_Orb_item.png
Mosstomper Seedling;ixtal;Associated with Ixtal's control over elemental magic and its protective stance, shielding the region from outside threats.;Provides a shield and tenacity after using a bush.;User gains +2 to AC and saves vs. fear for 1d4 rounds after contact with natural foliage.;https://wiki.leagueoflegends.com/en-us/images/Mosstomper_Seedling_item.png
Tear of the Goddess;targon;Often found near places of great celestial influence, this tear resonates with the magic of the Aspects and the stars.;Grants bonus mana and mana regeneration, scaling with mana spent.;Wearer gains +1 to cast spells. Each spell cast imposes a cumulative -1 penalty to subsequent castings until a short rest, then penalty resets.;https://wiki.leagueoflegends.com/en-us/images/Tear_of_the_Goddess_item.png
Cappa Juice;freljord;A popular drink amongst the hardy folk, rumored to contain a secret blend of frost berries and melted glacier ice. Associated with the Winter's Claw tribe.;Restores health and grants temporary movement speed boost.;Quaffing it heals 1d6 hp and grants +1 to Move rolls for 3 turns. Chance of frostbite if consumed in warm climates: take 1 cold damage per turn.;https://wiki.leagueoflegends.com/en-us/images/Cappa_Juice_item.png
Elixir of Iron;noxus;Favored by Noxian siege engineers and frontline soldiers, it grants size and resilience. Could be associated with the Black Rose through magical augmentation.;Grants increased size, tenacity, and damage reduction against champions.;Drink and grow mighty as an Ogre! But the concoction is unstable. Roll a d6, on a 1, suffer permanent size increase after the draught wears off! On a 6, shrink uncontrollably!;https://wiki.leagueoflegends.com/en-us/images/Elixir_of_Iron_item.png
Elixir of Wrath;noxus;Favored by arena combatants and bloodthirsty warlords seeking an edge in battle. Often used in the fighting pits of Noxus.;Grants attack damage, spell vamp, and empowers basic attacks on hit.;Upon consumption, grants +2 to hit and damage rolls. On a critical hit, regain 1d4 hit points. Lasts 5 turns. Afterwards, suffer -1 to hit rolls for 1 turn.;https://wiki.leagueoflegends.com/en-us/images/Elixir_of_Wrath_item.png
Refillable Potion;ionia;Commonly used by wandering monks and martial artists in Ionia to recover from strenuous training and meditation. Also popular among assassins.;Restores Health over time. Refills at the fountain.;Quaffing this potion restores 1d6 hit points over 3 rounds. The vial refills with use, but only in areas of natural power. (Example: Sacred Groves);https://wiki.leagueoflegends.com/en-us/images/Refillable_Potion_item.png
Oracle Lens;shadow isles;Used by sentinels to sweep for the Black Mist. It reveals hidden dangers and wards off the spectral tendrils of the Ruination.;Temporarily reveals invisible enemy units and disables enemy wards. Useful for scouting and clearing vision.;Grants the user brief glimpses into the ethereal plane, revealing hidden creatures and magical sigils. Grants advantage on saves vs. illusions and enchantments.;https://wiki.leagueoflegends.com/en-us/images/Oracle_Lens_item.png
Elixir of Avarice;bilgewater;Likely brewed by a Bilgewater alchemist, exploiting vulnerabilities for profit. Associated with the unscrupulous underworld.;Grants bonus gold on hit but reduces damage dealt to champions.;Grants +1d4 gold per successful attack, but imposes a -1 penalty to hit rolls against formidable foes. Represents a risky gamble for short-term gains.;https://wiki.leagueoflegends.com/en-us/images/Elixir_of_Avarice_item.png
Elixir of Skill;ionia;Brewed by monks in remote monasteries, it is said to unlock hidden potential within the imbiber. It may be connected to the spirit realm.;Grants bonus true damage and increased ability power.;Upon imbibing, the character must immediately roll a saving throw (Wisdom). On a success, +1 to cast spells and damage, bypassing armour. On a failure, summon a chaotic extra-planar entity.;https://wiki.leagueoflegends.com/en-us/images/Ichor_of_Illumination_item.png
Poro-Snax;freljord;Poro-Snax are a Freljord delicacy, irresistibly delicious to Poros, the fluffy creatures of the Howling Abyss. Legends say they contain magical warmth.;Feeds a Poro, causing it to grow larger and grant a temporary visual effect.;A handful of Snax charms any beast, and may ward off the chill of a magical blizzard. Consuming a whole bag grants temporary advantage on saves vs. cold damage.;https://wiki.leagueoflegends.com/en-us/images/Poro-Snax_item.png
Total Biscuit of Everlasting Will;demacia;Baked by a famed Demacian baker. It's rumored to have been blessed by a mage to keep soldiers going during long campaigns.;Restores health and mana upon consumption.;When consumed, heals 2d8 hit points and removes one level of exhaustion. This biscuit never spoils and can sustain one lost in the wild.;https://wiki.leagueoflegends.com/en-us/images/Total_Biscuit_of_Everlasting_Will_item.png
Berserker's Greaves;noxus;Favored by Noxian arena combatants, these greaves enhance speed, essential for dodging brutal attacks and exploiting fleeting openings in battle.;Increases attack speed and grants a moderate amount of movement speed.;Wearer gains +2 to initiative and attack rolls. Movement in combat is doubled. Upon a failed save vs. magic, wearer flies into a berserker rage.;https://wiki.leagueoflegends.com/en-us/images/Berserker%27s_Greaves_item.png
Boots of Swiftness;ionia;Favored by Ionian monks and messengers, these boots whisper of haste and a light step, essential for traversing vast landscapes.;Increases movement speed and reduces the effect of slows.;Wearer moves swiftly (+2 to Move silently checks, +2 to Run checks) and suffers less hindrance from binding magic or terrain.;https://wiki.leagueoflegends.com/en-us/images/Boots_of_Swiftness_item.png
Mercury's Treads;noxus;Favored by Noxian battlemages, the treads are rumored to have been enchanted by a forgotten hemomancer of the Black Rose.;Reduces the duration of stuns, slows, taunts, fears, silences, blinds, polymorphs, and immobilizes. Grants magic resistance.;Wearer saves against spells and enchantments with a +2 bonus. Furthermore, wearer is resistant to mind-altering effects, such as fear or charm, but is slightly more susceptible to poison damage.;https://wiki.leagueoflegends.com/en-us/images/Mercury%27s_Treads_item.png
Sorcerer's Shoes;noxus;Favored by Noxian mages and artificers, enhancing arcane power through specialized construction. Often seen in the Black Rose's inner circles.;Increases magic penetration, allowing spells to deal more damage by bypassing enemy magic resistance.;Wearer's spells ignore some magical defenses. Reduce the target's effective MR by 1 for every 3 levels of the caster. Against creatures with no MR, spells instead inflict +1 damage per die rolled.;https://wiki.leagueoflegends.com/en-us/images/Sorcerer%27s_Shoes_item.png
Synchronized Souls;ionia;Potentially crafted by monks seeking harmony, reflecting Ionian spiritual beliefs. Could be tied to the Spirit Blossom festival.;Grants bonus Ability Power and Haste, shared with a linked ally, empowering both champions.;Confers +2 to cast spells. If your linked ally is within 30', both gain +2 to cast spells, and any damage they take is reduced by 1. Be careful of range.;https://wiki.leagueoflegends.com/en-us/images/Synchronized_Souls_item.png
Amplifying Tome;ionia;Associated with the spirit magic traditions of Ionia, often used by novice mages to enhance their connection to the spirit realm.;Grants additional Ability Power, increasing the strength of spells and magical abilities.;Those who read from the tome find their spells cast for +1 damage die. But if a 1 is rolled, the spell fizzles as a wild surge.;https://wiki.leagueoflegends.com/en-us/images/Amplifying_Tome_item.png
Blasting Wand;ionia;Favored by Ionian mages, the wand amplifies the wielder's connection to the spirit realm, enhancing their spells.;Grants +40 Ability Power, increasing the damage of magical abilities.;When held, caster level is increased by 1 for purposes of spell damage. Wild magic surges are slightly more likely.;https://wiki.leagueoflegends.com/en-us/images/Blasting_Wand_item.png
Cloth Armor;demacia;Commonly used by Demacian soldiers for basic protection. Often enchanted by mages to enhance its defensive capabilities.;Grants a small amount of armor, reducing physical damage taken from enemy attacks.;Wearer gains +1 AC vs. bludgeoning and slashing attacks. Armor Penalty applies unless STR 13+. If the wearer is attacked by surprise, this armor provides no benefit.;https://wiki.leagueoflegends.com/en-us/images/Cloth_Armor_item.png
Faerie Charm;ionia;Often enchanted by Ionian monks, the Faerie Charm is thought to be infused with the essence of the spirit realm, aiding in meditation.;Provides mana regeneration.;The bearer regenerates 1 MP per turn in addition to their normal regeneration. Advantage on saving throws vs. magical exhaustion. Detect magic emanates from the charm.;https://wiki.leagueoflegends.com/en-us/images/Faerie_Charm_item.png
Long Sword;demacia;Commonly used by Demacian soldiers, the Long Sword is a symbol of martial readiness and basic combat training within the kingdom.;Provides a small amount of attack damage, increasing physical damage output.;A Long Sword grants +1 to hit. On a roll of natural 20, wielder inflicts +1 damage. Weapon can be broken on an additional damage die roll.;https://wiki.leagueoflegends.com/en-us/images/Long_Sword_item.png
Null-Magic Mantle;demacia;Commonly enchanted by magesmiths across Demacia to protect soldiers from rogue mages, or the magic of the Shadow Isles.;Grants magic resistance, reducing damage taken from enemy abilities.;Confers +1 to saves vs. spells and magical effects. If save succeeds, reduce damage by half. May glow faintly in the presence of powerful magic.;https://wiki.leagueoflegends.com/en-us/images/Null-Magic_Mantle_item.png
Rejuvenation Bead;freljord;Often found near ancient wells, rumored to be blessed by the Ice Witch, granting resilience to those who carry them.;Passively grants health regeneration.;Wearer heals 1 hit point per turn. If dropped into potable water, the well or stream heals 1d4 hit points to all creatures within 30 feet when imbibed.;https://wiki.leagueoflegends.com/en-us/images/Rejuvenation_Bead_item.png
Sapphire Crystal;targon;Often used by aspiring mages and celestial beings, channeling the power of the stars to enhance their arcane abilities, especially those associated with mana.;Grants additional mana, increasing the capacity for spellcasting and ability usage.;Wearer gains +4 to WIL saves vs. magical effects. On a successful save vs. a mana draining attack, gain 1d4 mana points. If the wearer has no mana, they can cast a single spell.;https://wiki.leagueoflegends.com/en-us/images/Sapphire_Crystal_item.png
Aether Wisp;ionia;Whispers say Aether Wisps are fragments of spirit magic, drawn to places of power or strong emotion within Ionia.;Grants bonus movement speed. Passive effect.;"Bestows fleetness of foot. The wielder's movement is subtly enhanced; chance to outrun foes or catch distant prey improves by 10%.";https://wiki.leagueoflegends.com/en-us/images/Aether_Wisp_item.png
Bandleglass Mirror;ionia;Crafted by Ionian artisans, this mirror reflects inner magic, enhancing connection to the spirit realm. Could be associated with the Kinkou Order.;Grants ability haste, mana regeneration, and amplifies healing and shielding power.;Upon gazing, caster gains +1 to cast 'Healing' or 'Charm' spells for (level) turns. Must save vs. WIS or be compelled to reveal darkest secret.;https://wiki.leagueoflegends.com/en-us/images/Bandleglass_Mirror_item.png
Bramble Vest;noxus;Favored by Noxian arena masters. Barbed armor punishes attackers, reflecting the brutal nature of gladiatorial combat.;Deals magic damage to attackers and applies Grievous Wounds to them for a short duration.;Upon taking damage from a melee attack, the attacker suffers 1d4 damage. If the attack deals piercing or slashing damage, the attacker must make a saving throw or suffer disadvantage on their next attack.;https://wiki.leagueoflegends.com/en-us/images/Bramble_Vest_item.png
Caulfield's Warhammer;demacia;Favored by Demacian smiths, the Warhammer is a symbol of craftsmanship and martial prowess, often carried by elite soldiers and artisans alike.;Provides attack damage and ability haste, enabling more frequent spell casts and stronger basic attacks.;Confers +1 to hit and damage. Once per day, reroll a failed attack roll. User suffers -1 to charisma checks when wielding (it's intimidating!).;https://wiki.leagueoflegends.com/en-us/images/Caulfield%27s_Warhammer_item.png
Crystalline Bracer;freljord;Forged with True Ice, it's favored by hardy souls battling the elements and those who value resilience above all else.;Increases health and health regeneration.;Wearer gains +2 to saves versus cold damage and recovers 1d4 hit points after each turn in frigid environments. If broken, may unleash a localized blizzard.;https://wiki.leagueoflegends.com/en-us/images/Crystalline_Bracer_item.png
Fated Ashes;shurima;Potentially linked to ancient Ascended rituals, granting sight beyond mortal limits. Whispers of Azir echo in its embers.;Dealing damage burns enemies, revealing them if they are camouflaged or invisible.;Creatures struck by fire must Save vs. Wisdom or be outlined in spectral fire, visible even through solid objects or magical darkness for 1d4 rounds. Camouflaged creatures are automatically revealed.;https://wiki.leagueoflegends.com/en-us/images/Fated_Ashes_item.png
Forbidden Idol;ionia;Said to be blessed by ancient spirits of Ionia, this idol is revered for its ability to amplify life energies and connect individuals to the spirit realm.;Increases base mana regeneration and heal and shield power.;Wearer gains +1 to all saving throws vs. spells and magical effects. Once per day, the wearer can attempt to turn undead as a cleric of equal level.;https://wiki.leagueoflegends.com/en-us/images/Forbidden_Idol_item.png
Glacial Buckler;freljord;Forged with ice magic, rumored to have originated with the Iceborn. Grants resilience against physical attacks.;Provides armor and mana, reduces cooldowns of abilities.;Grants +2 AC. Those who strike you in melee must SAVE vs. CON 14 or be slowed for 1 round as frost clings to their weapon.;https://wiki.leagueoflegends.com/en-us/images/Glacial_Buckler_item.png
Hearthbound Axe;freljord;Crafted by a forgotten Freljordian tribe, it was used by warriors known for chasing down enemies. Bears faint whispers of ancient hunts.;Move speed when near enemies. Gain more move speed when hitting an enemy with an attack.;Grants +1 to chase rolls. On a successful hit, the target must save vs. speed or be slowed (disadvantage on speed-based checks) for 1d4 rounds.;https://wiki.leagueoflegends.com/en-us/images/Hearthbound_Axe_item.png
Hextech Alternator;ionia;Potentially linked to the techmaturgical advancements of Clan Lito or other Ionian inventors seeking to harmonize magic with technology.;Grants bonus magic damage on your next attack after moving.;Grants +1 on a damage roll after moving at least 10ft during the current turn. Requires attunement by a character with the 'tinker' or 'mage' class.;https://wiki.leagueoflegends.com/en-us/images/Hextech_Alternator_item.png
Last Whisper;noxus;Favored by Noxian generals, the Last Whisper ensures their decrees cut through any resistance, solidifying their dominion through force and fear.;Grants armor penetration, allowing attacks to bypass a portion of the target's armor.;"Ignores AC. Roll 1d6; on a 6, target's armor permanently degrades by 1 AC due to unseen corrosive whispers.";https://wiki.leagueoflegends.com/en-us/images/Last_Whisper_item.png
Negatron Cloak;targon;Associated with the celestial realm of Targon, offering protection against the void's corrupting influence or the madness of the abyss.;Provides magic resistance, reducing damage from magical sources.;Grants +3 to saves vs. spells and spell-like effects. Wearer ignores the first magical attack each encounter (nullified).;https://wiki.leagueoflegends.com/en-us/images/Negatron_Cloak_item.png
Oblivion Orb;shadow isles;Associated with forgotten magics of the Shadow Isles, possibly linked to Mordekaiser's empire or the Black Mist's corruption.;Grants magic penetration. Applies Grievous Wounds on dealing magic damage.;Renders the target vulnerable to magic, inflicting festering wounds that resist healing. Save versus magic or take -1 to future saves until healed magically.;https://wiki.leagueoflegends.com/en-us/images/Oblivion_Orb_item.png
Quicksilver Sash;ionia;Crafted with Ionian spirit magic, rumored to have been developed to resist Noxian enchantments during their invasion.;Removes all crowd control effects from your champion. Grants magic resist.;Grants +3 to saves versus spells and illusions. Once per day, the wearer can automatically succeed on a saving throw against an enchantment or binding spell.;https://wiki.leagueoflegends.com/en-us/images/Quicksilver_Sash_item.png
Recurve Bow;ionia;Favored by Ionian archers, enhancing precision and speed. Often used in the defense of sacred groves against Noxian invaders.;Grants attack speed.;Ranged attacks deal +1 damage, and you may fire one additional arrow each round. Requires proficiency with bows. Crafted from enchanted wood.;https://wiki.leagueoflegends.com/en-us/images/Recurve_Bow_item.png
Scout's Slingshot;demacia;Commonly used by Demacian scouts, these slingshots are known for their accuracy and reliability in the field. Encourages youthful courage.;Damages a champion from range and grants a small burst of movement speed.;Once per day, hurl a stone with unnatural accuracy. If it hits, briefly gain +2 to your next Agility check to escape or pursue.;https://wiki.leagueoflegends.com/en-us/images/Scout%27s_Slingshot_item.png
Serrated Dirk;noxus;Favored by Noxian assassins and spies, the Serrated Dirk is a tool of treachery and swift, silent kills. Often associated with the Black Rose.;Grants Lethality (armor penetration) and bonus attack damage.;Creature struck must save versus Death or suffer -1 to AC for 1d4 turns. On a hit, next attack roll against target gains +2.;https://wiki.leagueoflegends.com/en-us/images/Serrated_Dirk_item.png
Sheen;demacia;Forged in Demacia, Sheen is rumored to be imbued with the strength of petricite, briefly amplifying the wielder's power after spellcasting.;After using an ability, the next attack deals bonus magic damage.;"Upon casting a spell, your next successful hit gains +1 to hit and deals +1d6 elemental damage. Effect fades quickly; use or lose.";https://wiki.leagueoflegends.com/en-us/images/Sheen_item.png
Steel Sigil;demacia;Forged in Demacia, the sigil represents unbreakable resolve, and defense against magic. It may be tied to the Petricite forests.;Provides armor and magic resist, enhancing survivability against physical and magical damage.;Wearer gains +1 to AC against mundane attacks and advantage on saves versus spells. Furthermore, the sigil negates the first magical attack each day. The sigil crumbles after negating 3 magical attacks.;https://wiki.leagueoflegends.com/en-us/images/Steel_Sigil_item.png
Tiamat;noxus;Forged in Noxus, Tiamat whispers promises of destruction, rumored to amplify the bloodlust of its wielder, pushing them towards brutal, overwhelming force.;Deals area of effect damage around the wielder on each attack, amplifying the damage dealt.;Upon a hit, unleash a shockwave (3d6 damage) to all within 5'. Save vs. STR to halve. Continued use corrupts, causing savage urges. On a failed WIS save, attack nearest ally.;https://wiki.leagueoflegends.com/en-us/images/Tiamat_item.png
Vampiric Scepter;noxus;Favored by Noxian gladiators, the scepter draws strength from struck foes, embodying the empire's brutal and opportunistic nature.;Grants lifesteal, restoring health based on damage dealt to enemies.;Drain 8 hit points from a foe when you hit them with a melee attack. These hit points are added to yours, not exceeding your maximum.;https://wiki.leagueoflegends.com/en-us/images/Vampiric_Scepter_item.png
Warden's Mail;demacia;Favored by Demacian sentinels. It is said to be blessed by the Mountain King to make the wearer immovable.;Reduces damage from basic attacks and reduces the attacker's attack speed.;Wearer takes -1 damage from bludgeoning attacks. Foes suffer -2 on attack rolls after striking the wearer for one round.;https://wiki.leagueoflegends.com/en-us/images/Warden%27s_Mail_item.png
Winged Moonplate;targon;Favored by Lunari warriors. Provides speed and resilience.;Provides bonus movement speed and health.;Grants +1 to Move Silently in moonlight. Once per day, add +1 to AC vs. ranged attacks if under the open sky.;https://wiki.leagueoflegends.com/en-us/images/Winged_Moonplate_item.png
Abyssal Mask;freljord;Whispers say it was forged in the Freljord's coldest depths, resonating with ancient watchers and forgotten ice magic.;Reduces magic resist of nearby enemies and increases magic damage dealt.;Creatures within 20' suffer -2 to saves vs. magic. The wearer's spells inflict +1 damage per die rolled. A chilling aura permeates the area.;https://wiki.leagueoflegends.com/en-us/images/Abyssal_Mask_item.png
Ardent Censer;targon;Favored by support champions, particularly those who can heal or shield allies, implying a connection to celestial beings or protectors.;Heals and shields on allies grant them increased attack speed and on-hit damage for a short duration.;Upon shielding an ally, their attacks land with supernatural speed, dealing +1 damage. If target is undead, inflict +1d4 radiant damage. User may suffer temporary blindness after use (1 in 6 chance).;https://wiki.leagueoflegends.com/en-us/images/Ardent_Censer_item.png
