Item Name;Region;Lore;DescriptionGame;DescriptionLore;ImageURL
Hunter's Machete;ionia;Favored by Ionian hunters and spirit walkers, allows one to track down dangerous beasts of the forests.;Bonus damage to monsters and increased experience gained from killing monsters in the jungle.;Grants +1 to tracking, +1 damage die on attacks against beasts. Spend 1 turn after battle butchering the beast. Replenishes 1d4 food.;https://wiki.leagueoflegends.com/en-us/images/Hunter%27s_Machete_item.png
Hunter's Talisman;ionia;Favored by Ionian spirit walkers and shadow stalkers, channels vital essence for hunting.;Bonus mana regen in the jungle and bonus damage to monsters.;Upon consumption of slain monsters, regain 1d4 mana. Furthermore, successfully tracking a beast yields advantage on your next attack roll.;https://wiki.leagueoflegends.com/en-us/images/Hunter%27s_Talisman_item.png
Ichor of Illumination;targon;Said to be created with concentrated starlight, this substance is rumored to enhance one's connection to the celestial realm.;Grants bonus ability power and mana regeneration.;Drinking this ichor allows the imbiber to cast one additional spell, but they take 1d6 radiant damage. A second draught is poison!;https://wiki.leagueoflegends.com/en-us/images/Ichor_of_Illumination_item.png
Immortal Shieldbow;demacia;Crafted by Demacian artisans, rumored to have protective enchantments from a Radiantite shard, safeguarding the wielder.;Grants a shield when taking damage that would reduce you below a certain health threshold.;"Wearer is enveloped in shimmering light when near death; prevents the next lethal blow. Foe must save vs. magic or be blinded for 1d4 rounds by the radiance.";https://wiki.leagueoflegends.com/en-us/images/Immortal_Shieldbow_item.png
Infinite Convergence;targon;Celestial in origin, resonating with the power of constellations and cosmic balance. Grants power from beyond the stars.;Periodically empowers abilities, increasing damage based on time spent in combat and champion level.;Once per round, reroll any die, adding your level to the result. On a natural 1 or 20, the stars align, granting advantage on all rolls for [level] rounds.;https://wiki.leagueoflegends.com/en-us/images/Infinite_Convergence_item.png
Innervating Locket;targon;Favored by the Solari, the locket may possess lunar magic, a counter to the Lunari. Perhaps tied to Leona's power and devotion to the sun.;Grants magic resist and health regeneration. Activates to shield nearby allies from incoming damage.;A shimmering field envelops allies: 2d6 damage negated. Undead hesitate to attack those shielded, unless compelled.;https://wiki.leagueoflegends.com/en-us/images/Innervating_Locket_item.png
Ironspike Whip;noxus;Favored by Noxian arena masters and pit fighters, this brutal whip embodies strength through dominance. Used to control beasts and break the wills of foes.;Deals damage to nearby enemies and grants movement speed when used. Useful for clearing waves and chasing enemies.;On a hit, target must save versus STR or be knocked prone. Those immune to being knocked prone must save versus WIL or be stunned for 1 round. User gains +1 to movement for 1 round.;https://wiki.leagueoflegends.com/en-us/images/Ironspike_Whip_item.png
Jaurim's Fist;freljord;Possibly named after a forgotten Freljordian hero. The item is a key component in more powerful equipment.;Grants health and attack damage that increases upon killing enemy units.;Wielder gains 1hp and +1 to hit for each foe slain in combat, lasting until the next dawn. If the fist is broken, the rage is dispelled.;https://wiki.leagueoflegends.com/en-us/images/Jaurim%27s_Fist_item.png
Kaenic Rookern;targon;Forged by the Solari, it resonates with celestial energy, offering protection against magical assaults for those deemed worthy by the Mountain.;Grants magic resist and a shield that absorbs magic damage. The shield regenerates when out of combat.;"Confers Advantage on saves vs. spells and spell-like abilities. If a saving throw is failed against a magical attack, the Rookern absorbs a portion of the blow; for 1d4 rounds, incoming magic damage is reduced by 2 points.";https://wiki.leagueoflegends.com/en-us/images/Kaenic_Rookern_item.png
Kindlegem;targon;Forged on Targon's slopes, it resonates with celestial energy, granting vitality and resilience to its wielder.;Grants health and ability haste, reducing cooldowns and increasing survivability in combat.;Grants +1 to hit dice rolls when resisting spells and poison, and heals 1d4 hp a turn when below half health.;https://wiki.leagueoflegends.com/en-us/images/Kindlegem_item.png
Kircheis Shard;demacia;Forged by a Demacian artificer, the Kircheis Shard is rumored to amplify the wielder's intent, channeling inner energy into a potent strike.;Energized attacks deal bonus magic damage and grant bonus movement speed.;Next melee attack deals +1d6 lightning damage and grants +1 to movement until end of turn. Chance to attract unwanted elemental attention from the sky.;https://wiki.leagueoflegends.com/en-us/images/Kircheis_Shard_item.png
Knight's Vow;demacia;Knights Vow is linked to Demacia and their ideals of protection and sacrifice. It is likely tied to a specific order of knights.;Redirects damage from an ally to the wearer, healing based on damage dealt by the ally.;The wearer designates a target, who becomes harder to hit (-2 AC). 10% of damage to the wearer is negated, but the target suffers equivalent damage as psychic feedback. Further, the wearer heals 1d6 hp when the target strikes a foe.;https://wiki.leagueoflegends.com/en-us/images/Knight%27s_Vow_item.png
Last Whisper;noxus;Forged in Noxus, rumored to have been used in assassinations, allows the user to pierce through the toughest armor.;Provides armor penetration, allowing physical damage to bypass a portion of the target's armor.;Bypass DR X times per day. On critical hit, bypass all DR. Weapon degrades non-magical armor it strikes. Undead and constructs are immune.;https://wiki.leagueoflegends.com/en-us/images/Last_Whisper_item.png
Legendary Assassin Item;noxus;Favored by assassins in the empire. Legends says they grant the wielder enhanced stealth and lethality.;Grants lethality and movement speed, increasing damage to isolated targets.;Upon a successful hit, target must save versus death or drop to 0 hp. On a miss, the attacker is revealed and takes double damage from all sources for 1 round.;https://wiki.leagueoflegends.com/en-us/images/Legendary_Assassin_Item_item.png
Legendary Mage Item;ionia;Crafted by Ionian monks, this staff enhances natural magic, resonating with the spirit realm and amplifying a mage's connection to the land.;The item grants increased magic power, mana regeneration, and reduces ability cooldowns.;Upon attunement, gain +2 to spellcasting rolls. Spend a turn in meditation to recover a lost spell slot (level 3 or lower). Once per day, commune with local spirits for cryptic advice.;https://wiki.leagueoflegends.com/en-us/images/Legendary_Mage_Item_item.png
Legendary Support Item;targon;Forged atop Mount Targon, imbued with celestial power. Favored by support Ascended and the Solari for aiding allies in need.;Grants gold and vision. Provides bonus health, mana regen, and ability haste, enhancing support capabilities.;Once per day, touch a willing ally to grant +1 to all saving throws for 1d4 turns. User gains temporary blindness for one turn after use.;https://wiki.leagueoflegends.com/en-us/images/Legendary_Support_Item_item.png
Leviathan;bilgewater;Rumored to have been crafted from a sea monster's hide, Leviathan whispers promises of power and dominance to its wielder.;Grants health and damage based on takedowns, lost on death. Resets stacks upon reaching maximum.;Confers +1 to AC. Each successful hit grants +1 temporary HP (max 10). Upon death, character returns at 1 HP. If character achieves 10 successful hits, character cannot die until the next dawn.;https://wiki.leagueoflegends.com/en-us/images/Leviathan_item.png
Liandry's Anguish;shadow isles;Associated with the Black Mist and its lingering magic, tormenting those who dare wield it. May be related to the Ruination.;Deals bonus magic damage over time and increased damage to slowed or immobilized targets.;Those struck suffer 1d4 damage each round for 3 rounds (save allowed). Those bound or slowed suffer 1d6 damage instead. Wielder must save vs. death each week or become a wraith.;https://wiki.leagueoflegends.com/en-us/images/Liandry%27s_Torment_item.png
Lifeline;freljord;Favored by warriors facing impossible odds in the Freljord, a 'Lifeline' is a blessing of the Ice Witch, granting temporary reprieve.;Shields the user from lethal damage and grants bonus attack damage when triggered.;Wearer is immune to a single source of damage. Upon trigger, gain +2 to hit and damage rolls for the next round, representing desperate aggression.;https://wiki.leagueoflegends.com/en-us/images/Lifeline_item.png
Lightbringer;demacia;Potentially forged by a Demacian artisan, rumored to channel the power of starlight. Might have been wielded by a hero fighting the darkness.;Deals bonus damage to enemies. Grants the wielder increased movement speed and attack speed for a short duration.;Suffer +1 AC from magical darkness. When swung, brightly illuminate a 30' radius. On hit, all undead and demons flee from the light (save vs. spell or turn to ash).;https://wiki.leagueoflegends.com/en-us/images/Lightbringer_item.png
Locket of the Iron Solari;targon;Forged on Targon, it resonates with celestial power. Often carried by those who stand against overwhelming darkness, inspired by the sun.;Provides magic resist and health. Active: grants a shield to nearby allies, protecting them from damage.;Confers +2 to saves vs. magic. Once per day, emit a radiant burst: allies within 30' gain 3d6 temporary hit points, absorb the next magic attack targeting them. ;https://wiki.leagueoflegends.com/en-us/images/Locket_of_the_Iron_Solari_item.png
Looted Oracle's Extract;bilgewater;Recovered from a drowned Oracle, it whispers secrets of unseen dangers, possibly linked to ancient sea curses or forgotten leviathans.;Detects invisible enemy units and disables enemy traps for a short duration.;Grants 1 turn of 'True Sight' (60ft range) and automatically disarms one magical trap. On a failed save (WIS 13), user experiences disturbing visions.;https://wiki.leagueoflegends.com/en-us/images/Looted_Oracle%27s_Extract_item.png
Lost Chapter;ionia;Associated with Ionian monasteries, used to focus magical studies. May have been owned by a powerful spirit walker.;Grants mana, ability haste, and mana regeneration upon leveling up.;The chapter grants +1 to cast spells, replenishing mana (spell slots) upon leveling up. However, overuse might attract spirits to the caster.;https://wiki.leagueoflegends.com/en-us/images/Lost_Chapter_item.png
Luden's Echo;ionia;The echo resonates with ancient Ionian magic, amplifying the wearer's spells, connecting them to the spirit realm and first lands.;Damaging abilities grant stacks. At 100 stacks, the next damaging ability consumes all stacks to deal bonus magic damage to the target and nearby enemies.;Once per day, unleash stored magical energy as a wave dealing 2d6 damage to all within 30'. Save vs. Magic or be stunned for 1 round. User must meditate for 1 turn to recharge.;https://wiki.leagueoflegends.com/en-us/images/Luden%27s_Echo_item.png
Luden's Pulse;ionia;Potentially associated with the ancient magic of Ionia and its reverence for spiritual energy. Could be tied to the Vastaya.;Damaging abilities grant stacks. At 100 stacks, the next damaging ability consumes all stacks to deal bonus damage and bounces to nearby enemies.;Upon casting a spell, roll a d6. On a 6, the spell chains to another target within sight, dealing half damage. The caster glows faintly for one turn.;https://wiki.leagueoflegends.com/en-us/images/Luden%27s_Pulse_item.png
Lucky Dice;bilgewater;Gamblers in Bilgewater often carry trinkets like these dice, hoping to sway Lady Luck in their favor during high-stakes games.;On a dice roll, reroll twice and take the highest result.;Once per day, reroll any failed roll. On a natural 1, the dice crumble to dust.;https://wiki.leagueoflegends.com/en-us/images/Twisted_Fate_Loaded_Dice.png
Madred's Razors;noxus;Favored by monstrous creature hunters in the pits of Noxus, this item was made to quickly dispatch large beasts.;Deals bonus damage to monsters and grants a chance to deal bonus damage on hit.;On a successful hit against a monstrous creature, roll 1d6. On a 6, deal double damage. If damage exceeds HP, the creature explodes in a shower of gore.;https://wiki.leagueoflegends.com/en-us/images/Madred%27s_Razors_item.png
Malignance;targon;Whispers from the celestial realm suggest a connection to fallen watchers and their influence on Runeterra's magic, amplified through Targon's celestial energies.;Imbues magic damage with burning, reducing magic resist of enemies hit and creating a damaging area.;Casting spells risks attracting otherworldly attention, inflicting a burning curse (-1 to saves vs. magic) and creating a zone of aberrant energy (1d6 damage/round, save vs. magic to negate).;https://wiki.leagueoflegends.com/en-us/images/Malignance_item.png
Mana Manipulator;ionia;Favored by Ionian monks seeking inner peace and harmony, aiding meditation and channeling of spiritual energy.;Provides increased mana regeneration. Grants bonus mana upon using an ability.;Wearer gains +1 to cast spells without components. Recover 1d4 mana per turn meditating. On a roll of 1, the meditation draws unwanted attention.;https://wiki.leagueoflegends.com/en-us/images/Mana_Manipulator_item.png
Manamune;ionia;Forged in Ionia, Manamune's creation involved spirit magic, resonating with the land's inherent energy and the interconnectedness of its inhabitants.;Grants bonus attack damage based on maximum mana and refunds mana on ability casts, stacking to transform into Muramana.;Wearer gains +1 to hit and damage rolls for every 5 points of mana. Spells cost 1 less mana. When mana is exhausted, the blade transforms, dealing +1d6 damage on a hit until rested.;https://wiki.leagueoflegends.com/en-us/images/Manamune_%28Quick_Charge%29_item.png
Mariner's Vengeance;bilgewater;Crafted from shipwrecked souls and sea salt, it whispers tales of vengeance from the depths. Associated with lost mariners.;Upon taking fatal damage, become untargetable and continue attacking for a short duration.;Upon death, the wielder's spirit lingers, fueled by rage. They lash out with spectral attacks before passing on, possibly becoming a ghost if slain again during this period (1-in-6 chance).;https://wiki.leagueoflegends.com/en-us/images/Mariner%27s_Vengeance_item.png
Martyr's Gambit;demacia;Potentially linked to Demacian knights, as a tool to protect allies and inspire courage through self-sacrifice.;Taunts nearby enemies, reduces damage taken, and deals damage to nearby enemies upon damage taken and at the end of the duration.;Wearer gains +3 to AC, but all attacks targetting allies within 30' are redirected to them, attacker makes a DC 15 WIL save or attacks the wearer. On expiring, explodes for 2d6 damage to all within 10'.;https://wiki.leagueoflegends.com/en-us/images/Martyr%27s_Gambit_item.png
Mejai's Soulstealer;noxus;Associated with dark magic and power accumulation, perhaps favored by ambitious Noxian mages seeking forbidden knowledge. Could be connected to the Black Rose.;Grants ability power upon champion kills and assists, lost on death. Stacks up to 25 times for massive AP.;"Steal the souls of slain foes. Each soul grants +1 to cast checks. On death, roll a d6; on a 1-3, lose half of your stacks. On a 4-6, lose all stacks.";https://wiki.leagueoflegends.com/en-us/images/Mejai%27s_Soulstealer_item.png
Mikael's Blessing;targon;Linked to an ancient order on Targon, dedicated to purity and protection against corruption from the Void.;Removes all crowd control effects from an ally and grants them a brief period of crowd control immunity.;Touch ally to negate paralysis, poison, and charm. Target gains +4 to saves vs. mental effects for 3 turns. Upon use, user ages 1d4 weeks, reflecting the blessing's burden.;https://wiki.leagueoflegends.com/en-us/images/Mikael%27s_Blessing_item.png
Minion Dematerializer;shurima;Potentially a tool utilized by the Ascended to manage and control the flow of lesser beings and resources within their empire.;Consumes minions to gain damage bonuses against that minion type.;As an action, touch a corporeal undead to attempt to banish it. The target must make a saving throw vs. item level or be instantly turned to harmless dust.;https://wiki.leagueoflegends.com/en-us/images/Minion_Dematerializer_item.png
Mobility Boots;shurima;Favored by messengers and scouts across the desert, granting swift passage between oases and ancient ruins. Often enchanted with protective spirits.;Greatly increased out-of-combat movement speed, reduced when in combat.;Wearer moves at x2 speed when unburdened. If attacked, must SAVE vs. DEX 14 or boots slow to normal speed for 1d4 turns. Blessed versions may ignore the SAVE.;https://wiki.leagueoflegends.com/en-us/images/Mobility_Boots_item.png
Moonflair Spellblade;targon;Linked to the Lunari, wielding moon magic. Might be associated with champions like Diana, who draws power from the moon.;Grants magic resist and ability haste, while also providing a shield after casting an ultimate ability.;Grants advantage on saving throws vs. magic and grants the wearer a ward that absorbs damage once per day after calling upon their inner power (casting a 6th level spell or higher).;https://wiki.leagueoflegends.com/en-us/images/Moonflair_Spellblade_item.png
Morellonomicon;noxus;Associated with forbidden knowledge and necromantic practices within Noxus. Possibly tied to the Black Rose or dark mages seeking immortality.;Applies Grievous Wounds to enemies hit by abilities, reducing their healing.;Target's wounds fester, healing provides no succor. Saving throw (Wisdom) or incur disadvantage on subsequent Constitution checks until healed by divine magic or a full day's rest.;https://wiki.leagueoflegends.com/en-us/images/Morellonomicon_item.png
Nashor's Tooth;shurima;Rumored to be crafted for the Ascended, perhaps at the behest of a long-lost emperor for a monstrous champion.;"Grants AP, attack speed, and on-hit damage; perfect for hybrid damage dealers who weave spells and attacks.";Wielder gains +2 to hit in melee, +2 to cast spells. On a hit, target must SAVE vs. Poison or take 1d6 damage. Breaks if used by a non-mage.;https://wiki.leagueoflegends.com/en-us/images/Nashor%27s_Tooth_item.png
Needlessly Large Rod;ionia;Favored by mages in Ionia, enhancing their natural connection to the spirit realm and amplifying their spellcasting abilities.;Grants a large amount of ability power, increasing the damage of spells.;Rod imbues +1d4 to magic damage rolls. However, if 1 is rolled, the spell fizzles, and the caster takes 1d4 backlash damage.;https://wiki.leagueoflegends.com/en-us/images/Needlessly_Large_Rod_item.png
Netherstride Grimoire;shadow isles;Whispers suggest it's linked to a fallen Shadow Isles mage, seeking to corrupt the living with arcane power.;Grants ability haste and mana. Empowers the user's next ability after casting an ultimate.;Once per day, after casting a ritual of 6th level or higher, the next spell cast before the sun rises is cast as if by a scroll, ignoring material components up to 50 gold.;https://wiki.leagueoflegends.com/en-us/images/Netherstride_Grimoire_item.png
Ninja Tabi;ionia;Favored by Ionian martial artists. Legends say masters can move like shadows while wearing them, blending into the spirit realm.;Reduces damage from basic attacks and provides movement speed.;AC 13. wearer reduces damage from mundane missile attacks by 2 points and moves +10' when exploring or evading in wilderness or urban environments. If fleeing reduce encounter distance by half.;https://wiki.leagueoflegends.com/en-us/images/Ninja_Tabi_item.png
Nomad's Medallion;targon;Associated with Targon's nomadic people. Grants resilience and empowers allies nearby, embodying the mountain's supportive aspect.;Grants health regeneration, mana regeneration, and bonus gold. Provides aura of mana regen to nearby allies.;Wearer heals 1hp per round and regenerates 1 mana per turn. Allies within 30' also regen mana. +1 to saves vs. exhaustion.;https://wiki.leagueoflegends.com/en-us/images/Nomad%27s_Medallion_item.png
Null-Magic Mantle;demacia;Crafted by Demacian mages, the Null-Magic Mantle protects against arcane threats, commonly used by frontline soldiers and mageseekers.;Provides magic resistance, reducing damage taken from enemy abilities.;Confers advantage on saves versus spells and magical effects. On a failed save, halve damage. If already resistant to magic, reduce magical damage taken by one-quarter.;https://wiki.leagueoflegends.com/en-us/images/Null-Magic_Mantle_item.png
Obsidian Cleaver;noxus;Favored by Noxian commanders, the Obsidian Cleaver sunders armor, leaving enemies vulnerable to further assaults. Represents raw, brutal power.;Deals physical damage, reduces enemy armor, and grants movement speed on hit.;On a hit, target must save vs. crushing blow or suffer -1 to AC. Cleaving a foe strengthens the wielder, increasing movement by 10' for a turn.;https://wiki.leagueoflegends.com/en-us/images/Obsidian_Cleaver_item.png
Odyn's Veil;freljord;Likely crafted by the ancient Iceborn, a relic against magical assaults. Perhaps tied to a forgotten god or powerful ice witch.;Grants magic resist and reduces incoming magic damage. Provides a burst of damage upon taking enough magic damage.;Wearer gains +3 to saves vs. spells. If targeted by a harmful spell, unleash a shock dealing 1d6 cold damage to the caster.;https://wiki.leagueoflegends.com/en-us/images/Odyn%27s_Veil_item.png
Ohmwrecker;targon;Favored by those scaling the mountain, rumored to be blessed by ancient aspects for protection.;Disables nearby enemy turrets for a short duration, allowing for safer sieges.;Once per day, emit a pulse. Stone and metal constructs nearby become inert for 1d4 rounds. A save versus magic negates.;https://wiki.leagueoflegends.com/en-us/images/Ohmwrecker_item.png
Oponn's Razor;ionia;Crafted by a reclusive Ionian bladesmith, rumored to have ties to the ancient teachings of the Kinkou Order.;Dashes empower your next attack to slow the target and deal bonus damage.;On a hit after dashing, target must SAVE vs DEX or be slowed (treat as entangled), and take +1d6 damage. User is momentarily winded (-1 to next roll).;https://wiki.leagueoflegends.com/en-us/images/Oponn%27s_Razor_item.png
Oracle's Elixir;demacia;Potentially used by Demacian mageseekers to detect hidden magic or illusions. Could be associated with Sylas's escape.;Grants true sight, revealing invisible units and disabling enemy wards for a short duration.;Reveals invisible creatures and traps. Grants advantage on saving throws vs. illusions. Causes a burning sensation when near magical items and spellcasters.;https://wiki.leagueoflegends.com/en-us/images/Oracle%27s_Elixir_item.png
Oracle's Hood;targon;Forged on Targon, rumored to ward against celestial trickery or the gaze of Aspects. Sought after by those who deal with cosmic entities.;Grants magic resistance. Passively grants immunity to magic damage every 90 seconds.;Wearer is +3 to saves vs. illusion and mind-affecting magic. Once per day, wearer ignores the effects of a single harmful spell that targets them.;https://wiki.leagueoflegends.com/en-us/images/Oracle%27s_Hood_item.png
Orb of Winter;freljord;Likely forged in the Freljord, possibly tied to the Winter's Claw or another ice-based faction. Grants resilience in harsh conditions.;Grants bonus health, mana, and ability haste. Transforms into Fimbulwinter when meeting certain conditions.;Grants +3 to saves vs. cold, provides 1 ration of food per day, and once per day, creates a barrier of ice that absorbs 1d6 damage. If broken, the Orb shatters, becoming useless.;https://wiki.leagueoflegends.com/en-us/images/Orb_of_Winter_item.png
Overlord's Bloodmail;noxus;Favored by Noxian arena champions, Overlord's Bloodmail is a testament to brutal strength and the will to dominate, embodying the empire's values.;Grants health, attack damage, and temporary bonus health/size on takedown.;Wearer gains +3 hit points. On slaying a foe, swell to ogre-size for 1d4 turns (+1 to hit, -1 AC). Afterwards, must SAVE vs. Poison or be Exhausted.;https://wiki.leagueoflegends.com/en-us/images/Overlord%27s_Bloodmail_item.png
Pauldrons of Whiterock;freljord;Forged in the icy heart of the Freljord, these pauldrons are rumored to have been worn by a forgotten Iceborn warrior.;Immobilizing an enemy grants bonus armor and magic resist to nearby allies.;When wearer freezes a foe, allies gain +2 AC and +1 to saves vs. magic for 3 turns. The pauldrons whisper forgotten battle tactics.;https://wiki.leagueoflegends.com/en-us/images/Pauldrons_of_Whiterock_item.png
Pendant of Zephiris;ionia;Said to be blessed by the Zephyr winds of Ionia, granting the wearer unnatural agility and speed. Perhaps a connection to a wind spirit.;+25 Attack Damage, +25% Attack Speed, +10% Cooldown Reduction, +10% Movement Speed.;Grants +1 to DEX. Once per day, reroll a failed DEX saving throw. Subject to whims of weather, storms may hinder its power (-1 DEX in strong winds).;https://wiki.leagueoflegends.com/en-us/images/Pendant_of_Zephiris_item.png
