Item Name;Region;Lore;DescriptionGame;DescriptionLore;ImageURL
Executioner's Calling;noxus;Favored by Noxian generals for its brutal efficiency, the blade inflicts grievous wounds, hindering regeneration and healing on the battlefield.;Deals physical damage and applies Grievous Wounds, reducing the effectiveness of healing on the target for a short duration.;On hit: target cannot regain hit points through spells or abilities. Potions and natural healing are at 1/4 effectiveness. Lasts 8 seconds, or until target rests.;https://wiki.leagueoflegends.com/en-us/images/Executioner%27s_Calling_item.png
Giant's Belt;freljord;Often reinforced with True Ice, Giant's Belts are favored by hardy Freljordian warriors and chieftains for their resilience.;Grants bonus health, increasing survivability in combat.;Wearer gains +1 hit point per level. If reduced to 0 hit points, wearer may make a DC 15 Constitution saving throw. On success, they are instead reduced to 1 hit point.;https://wiki.leagueoflegends.com/en-us/images/Giant%27s_Belt_item.png
Hexdrinker;noxus;Favored by low-ranking Noxian officers to protect from magical attacks. Some speculate it's made from captive mages' essence.;Grants magic resist and a shield that absorbs magic damage when taking damage.;Confers +2 to saves versus spells. Upon taking magic damage, negates the next spell entirely, then crumbles to dust.;https://wiki.leagueoflegends.com/en-us/images/Hexdrinker_item.png
Runic Compass;freljord;Associated with nomadic tribes navigating the harsh Freljordian landscape, seeking ancient ruins and forgotten paths.;Grants gold and experience over time. Generates a ward after leaving spawn.;"Tracks the nearest source of untapped magic or ancient power; glows brighter when near ley lines. Once per day, casts 'phantom ward' (lasts 1 turn, 10' radius).";https://wiki.leagueoflegends.com/en-us/images/Runic_Compass_item.png
The Brutalizer;noxus;Favored by Noxian arena fighters, the Brutalizer enhances aggression and lethality, embodying the empire's values.;Grants attack damage and armor penetration. Previously granted cooldown reduction.;Weapon grants +1 to hit and damage rolls. On a critical hit, target's AC is permanently reduced by 1 (cumulative) due to shattered armor.;https://wiki.leagueoflegends.com/en-us/images/The_Brutalizer_item.png
Verdant Barrier;demacia;Likely crafted in Demacia, given its resistance to magic and the nation's anti-magic stance. May be related to Galio or the petricite forests.;Provides magic resist and ability power. Absorbs some magic damage via a shield when taking damage.;Confers +2 to saves vs. magical effects. Once per day, absorb a magical attack, converting damage to temporary hit points.;https://wiki.leagueoflegends.com/en-us/images/Verdant_Barrier_item.png
Zeal;ionia;Favored by Ionian duelists seeking swiftness, its origins trace back to ancient movement techniques studied in monasteries.;Increases movement speed and critical strike chance.;Bestows +1 to initiative rolls. When charging into melee, roll +1 to hit. On a critical hit, move an additional 1d4 hexes after the attack.;https://wiki.leagueoflegends.com/en-us/images/Zeal_item.png
Axiom Arc;noxus;Favored by Noxian assassins, the Axiom Arc whispers promises of swift victories and unforgettable executions. It may have ties to the Black Rose.;Refunds a large portion of your ultimate's cooldown upon scoring a takedown.;Upon slaying a worthy foe, roll under your Intelligence score. If successful, reduce your XP needed to level by 10%. If you fail, an enemy’s spirit haunts your dreams that night.;https://wiki.leagueoflegends.com/en-us/images/Axiom_Arc_item.png
Blade of the Ruined King;shadow isles;Forged in the Shadow Isles, it corrupts the wielder, draining life and empowering attacks. Linked to the Ruination and potentially Viego.;Deals damage based on enemy health, steals movement speed, and heals the wielder.;On a hit, target must save vs death or lose 1d4 STR and grant it to the wielder as HP. On a fumble, user must save vs death or be charmed as per the spell by an unknown entity.;https://wiki.leagueoflegends.com/en-us/images/Blade_of_the_Ruined_King_item.png
Bounty of Worlds;shurima;Crafted with materials echoing Ascended might, its creation may be tied to a powerful mage seeking to restore Shurima's glory.;Grants bonus gold and experience upon assisting in champion kills.;The bearer gains uncanny luck attracting allies during battle. Allies are more likely to survive, even against overwhelming odds, and share knowledge of hidden treasures (roll +1 on encounter checks).;https://wiki.leagueoflegends.com/en-us/images/Bounty_of_Worlds_item.png
Cryptbloom;shadow isles;Likely tied to the Black Mist and the life-draining magic of the Shadow Isles. Could be related to the Ruination.;Heals allies when dealing damage and grants them bonus magic resist. Provides healing and ability power.;Creatures struck by spells while blooming must Save vs. Death or become withered, taking 1d4 damage each round as they slowly turn into spectral flora. Nearby allies are briefly fortified.;https://wiki.leagueoflegends.com/en-us/images/Cryptbloom_item.png
Dream Maker;targon;Crafted by celestial artisans, it is said to be imbued with the power to shape dreams and destinies, influenced by Zoe.;Grants bonus Ability Haste and empowers healing and shielding abilities.;"Heal allies at range (1d6 hp). Protect allies from attacks for one round; must rest to regain ability. Grants +1 to cast dream magic.";https://wiki.leagueoflegends.com/en-us/images/Dream_Maker_item.png
Essence Reaver;ionia;Said to be tied to ancient Ionian magic, possibly related to spirit energy manipulation techniques or a lost sword-fighting style.;Grants attack damage, critical strike chance, and mana regeneration based on damage dealt.;On a critical hit, the wielder regains expended magical energy, briefly regaining clarity and focus in battle. High chance of addiction.;https://wiki.leagueoflegends.com/en-us/images/Essence_Reaver_item.png
Frozen Heart;freljord;Forged in the coldest reaches of the Freljord, rumored to have been touched by the spirit of a long-dormant ice giant.;Reduces attack speed of nearby enemies and grants armor and mana.;Nearby creatures suffer -2 to attack rolls. Grants +3 AC. User gains +1 to WIL saves vs. cold.;https://wiki.leagueoflegends.com/en-us/images/Frozen_Heart_item.png
Hextech Rocketbelt;noxus;Associated with ambitious Noxian artificers seeking to enhance mobility and burst damage. Could be linked to a secretive hextech research division.;Dashes a short distance and fires projectiles, dealing magic damage.;Once per day, propel forward 30' and unleash a blast dealing 2d6 damage to all within 10'. Save vs. Dex or be knocked prone. Requires a rare power cell to recharge.;https://wiki.leagueoflegends.com/en-us/images/Hextech_Rocketbelt_item.png
Hullbreaker;bilgewater;Favored by reavers and shipwrights, especially useful for claiming coastal territory and isolated outposts without drawing the full fleet's attention.;"Grants armor, magic resist, and attack damage. Empowered siege minions; nearby allies get less XP.";Wearer gains +2 AC and +2 to hit when fighting near structures. Allies within 30' suffer -1 to hit. Siege attacks do double damage. A cursed item for wanderers.;https://wiki.leagueoflegends.com/en-us/images/Hullbreaker_item.png
Kraken Slayer;bilgewater;Forged in Bilgewater, associated with sea monster hunting. Grants the user the ability to take down any monstrosity in the seas.;Every third attack deals true damage. Provides attack damage, attack speed, and critical strike chance.;On every third successful attack roll, ignore the target's armor. If the target is a sea monster, deal double damage. Grants +2 to hit rolls.;https://wiki.leagueoflegends.com/en-us/images/Kraken_Slayer_item.png
Lord Dominik's Regards;demacia;Crafted by a Demacian weaponsmith to pierce even the thickest armor, it might have been used in wars against Noxus or the Freljord.;Grants armor penetration and increased damage against tanky targets based on the health difference.;Creatures struck by this weapon have their AC temporarily lowered, and those with high HP totals suffer extra damage, representing a chink in their defenses found and exploited.;https://wiki.leagueoflegends.com/en-us/images/Lord_Dominik%27s_Regards_item.png
Mercurial Scimitar;shurima;Crafted with sands from Shurima and imbued with ancient magic, it offers protection against curses and debilitating magics.;Grants attack damage, magic resist, and a cleanse that removes crowd control effects.;Wearer is immune to paralysis, petrification, and charm. A saving throw is allowed against spells of enslavement or domination, with a +4 bonus. Once per day, the wielder can negate an ongoing magical effect, such as a binding spell.;https://wiki.leagueoflegends.com/en-us/images/Mercurial_Scimitar_item.png
Mortal Reminder;noxus;Favored by Noxian duelists and executioners, its whisper erodes even the mightiest defenses, ensuring a swift end.;Grants armor penetration and Grievous Wounds, reducing healing received by the target.;On hit: Target's AC is reduced by 2 for 1d4 rounds. Further, any healing received is halved for the duration. Usable once per round.;https://wiki.leagueoflegends.com/en-us/images/Mortal_Reminder_item.png
Phantom Dancer;ionia;Favored by duelists and dancers across Ionia, the Phantom Dancer is said to grant its wearer supernatural speed and grace.;"Grants attack damage, attack speed, critical strike chance, and movement speed; also grants phasing and a lifeline.";Wearer gains +1 to AC and +2 to hit when fighting one-on-one. On a failed save vs. death, instead go to 1hp and flee the fight at double speed (save vs. fear).;https://wiki.leagueoflegends.com/en-us/images/Phantom_Dancer_item.png
Rapid Firecannon;ionia;Enhances ranged attacks, reminiscent of Ionian archers who imbue their shots with mystical energy for greater reach and impact.;Grants increased attack range and energizes attacks to deal bonus magic damage on hit.;"Ranged attacks gain +50% range; successful hits deal +1d6 lightning damage. Once per day, may ignore cover penalties. Mishaps arc to nearest ally, dealing 1d6 lightning damage.";https://wiki.leagueoflegends.com/en-us/images/Rapid_Firecannon_item.png
Serpent's Fang;noxus;Favored by Noxian assassins. Associated with the Black Rose and Leblanc, for their ability to manipulate and break through defenses.;Deals bonus damage to enemies with shields, briefly reducing their shield.;On hit, target's AC is penalized by -2 [1 round]. If target relied on magical protection, they must save vs. Spells or also lose 1d4 hp.;https://wiki.leagueoflegends.com/en-us/images/Serpent%27s_Fang_item.png
Solstice Sleigh;freljord;Likely crafted by a forgotten Freljordian tribe, it evokes themes of protection and winter resilience, potentially tied to the Winter's Claw.;Heals allies and grants them bonus movement speed when near the user.;Grants +1 to AC to nearby allies and advantage on saves vs. cold. Once per day, user may summon a spectral sled dog to pull them a short distance.;https://wiki.leagueoflegends.com/en-us/images/Solstice_Sleigh_item.png
Statikk Shiv;ionia;Associated with Ionian storm mages and the harnessing of raw magical energy into directed bursts, reminiscent of Ionian traditions.;Periodically emits chain lightning, damaging multiple nearby enemies on attack.;"Grants the ability to discharge stored electricity, dealing 1d6 lightning damage to a primary target and arcing to up to 2 nearby foes; Save vs. Lightning or be stunned for 1 round.";https://wiki.leagueoflegends.com/en-us/images/Statikk_Shiv_item.png
Sundered Sky;targon;Forged atop Mount Targon, it resonates with celestial power, potentially linked to the Aspect of the Twilight or the Aspect of War.;First attack after casting a spell crits, heals you and grants armor pen. Cooldown is based on base AD.;Upon striking a foe after invoking a celestial power, the wielder heals 1d6 HP and ignores the foe's armor for one attack. Recharge after combat.;https://wiki.leagueoflegends.com/en-us/images/Sundered_Sky_item.png
Trailblazer;demacia;Associated with Demacian vanguard tactics, enabling swift and fortified advances. Could be connected to the Dauntless Vanguard.;Empowers siege, granting bonus damage to structures. Nearby allies gain increased movement speed when moving towards turrets or structures.;Grants +1 to siege checks. Allies within 30' gain +2 to movement when charging fortifications or fortified positions. Structures automatically take maximum damage for 1d4 rounds.;https://wiki.leagueoflegends.com/en-us/images/Trailblazer_item.png
Vigilant Wardstone;demacia;Used by sentinels and mages of the White City, allowing greater reach and vigilance against threats both seen and unseen.;Increases ability haste, health, and allows placement of more wards. Also increases ward range.;Grants +1 to Wisdom saving throws against illusions and reveals hidden enemies within 60'. The holder can maintain one extra active magical ward or trap.;https://wiki.leagueoflegends.com/en-us/images/Vigilant_Wardstone_item.png
Winter's Approach;freljord;Forged in the coldest reaches of the Freljord, it's said to ward off the chilling touch of the Watchers.;Provides mana, armor, and ability haste. Converts mana into health and grants a shield when near enemies.;Wearer gains +2 to saves versus cold. When in danger, a spectral barrier absorbs 1d6 damage, but requires 1d4 turns to recharge. If barrier breaks, wearer must test vs. paralysis or be frozen solid.;https://wiki.leagueoflegends.com/en-us/images/Winter%27s_Approach_item.png
Zaz'Zak's Realmspike;shurima;Likely tied to the Void and the Watchers. Possibly a tool used by the Ascended in their battles against the Void.;Periodically summons a Void grub that explodes on enemies.;Once per day, summon a 1 HD voidling that explodes for 1d6 damage in a 5' radius. On a fumble, the voidling attacks the summoner. ;https://wiki.leagueoflegends.com/en-us/images/Zaz%27Zak%27s_Realmspike_item.png
Death's Daughter;bilgewater;Associated with the Buhru tribe and sea monster hunting rituals of Bilgewater. Possibly used to appease or control sea beasts.;Deals physical damage and slows enemies. Applies grievous wounds.;Target suffers -2 to saves vs. poison. Anyone eating creature struck with this weapon must test vs. paralyzation or become paralyzed for 1d4 turns.;https://wiki.leagueoflegends.com/en-us/images/Death%27s_Daughter_item.png
Black Hole Gauntlet;targon;Forged in the heart of a dying star, the Black Hole Gauntlet is rumored to be connected to the Aspect of the Void.;Periodically pulls nearby enemies closer, dealing magic damage based on their maximum health.;Once per day, touch the gauntlet to create a 10' radius sphere, those inside must make a DC 15 Strength save or be pulled 5' closer to the center, taking 1d6 damage per character level.;https://wiki.leagueoflegends.com/en-us/images/Black_Hole_Gauntlet_item.png
Darksteel Talons;noxus;Forged in the darkest Noxian forges, whispered to be infused with souls of conquered foes. Linked to the Black Rose.;Deals bonus damage after dashing, or exiting stealth, and grants armor penetration.;On a hit after moving 40ft in a single round, deal +1d6 damage. Further, attacks are made as if the target's AC is 2 less.;https://wiki.leagueoflegends.com/en-us/images/Darksteel_Talons_item.png
Detonation Orb;noxus;Crafted by Noxian artificers, the Detonation Orb is rumored to utilize forbidden hemomancy for explosive power, favored by demolition squads.;Deals area damage after a delay. Triggers on-hit effects. Good for wave clear and burst.;Orb deals 3d6 fire damage to all within 10ft. Save vs. Breath for half damage. Those slain by the Orb explode dealing 1d6 fire damage to those within 5ft.;https://wiki.leagueoflegends.com/en-us/images/Detonation_Orb_item.png
Duskblade of Draktharr;noxus;Favored by Noxian assassins and spies. Grants the wielder the element of surprise, negating an enemy's awareness.;Grants invisibility after killing an enemy champion. Next attack deals bonus damage, especially against wards. Disables traps.;Upon slaying a foe, vanish from sight (as per Invisibility spell). First strike deals +1d6 damage and bypasses armor if target is unawares. Pass unseen through magical wards and mundane traps.;https://wiki.leagueoflegends.com/en-us/images/Duskblade_of_Draktharr_item.png
Flesheater;noxus;Likely created by hemomancers in Noxus, Flesheater could be associated with the Black Rose or a warlord seeking power through blood magic.;Grants increasing damage and lifesteal as the wearer damages enemies in combat.;Upon a hit, wielder gains +1 to hit and damage rolls until the end of combat. For every three successful hits, they recover 1d4 hit points. The blade whispers promises of power.;https://wiki.leagueoflegends.com/en-us/images/Flesheater_item.png
Gambler's Blade;bilgewater;Favored by fortune tellers and swindlers alike. The blade is rumored to have been first owned by a card shark known as 'The River King'.;On hit, grants a stacking buff that increases critical strike chance, lost on being hit.;Upon a successful hit, the wielder gains +1 Luck modifier to the next roll, stacking. Upon being hit, the wielder is cursed, resulting in -1 Luck modifier.;https://wiki.leagueoflegends.com/en-us/images/Gambler%27s_Blade_item.png
Kinkou Jitte;ionia;Associated with the Kinkou Order, this jitte might have been wielded to maintain balance and discipline.;Grants bonus armor and magic resist, reducing damage from enemy champions.;"Confers +2 AC. Once per day, deflect a single attack; attacker takes damage equal to your level. Requires Lawful alignment to attune.";https://wiki.leagueoflegends.com/en-us/images/Kinkou_Jitte_item.png
Night Harvester;shadow isles;Crafted in the Shadow Isles, it drains the life force of enemies, possibly linked to the Black Mist's power.;"Grants bonus damage and movement speed on champion damage; cooldown per champion.";Upon striking a foe, inflict 1d6 necrotic damage. If the target dies this turn, move again this turn with +2 to movement.;https://wiki.leagueoflegends.com/en-us/images/Night_Harvester_item.png
Reaper's Toll;shadow isles;A tool used by the Harrowing's reapers, it enhances their ability to collect souls. Connected to the Black Mist and spectral entities.;Deals bonus damage based on the target's missing health, increasing execute potential.;On a hit, target must save vs Death or take double damage. Undead are immune. Wielder must make a Wisdom save after use or become shaken.;https://wiki.leagueoflegends.com/en-us/images/Reaper%27s_Toll_item.png
Sword of the Divine;targon;Forged on the slopes of Mount Targon, rumored to briefly grant the wielder the aspect of the divine.;Grants high attack speed and bonus damage for a short duration.;Once per day, gain +4 to hit and double weapon damage for 1 round. Afterwards, -2 to hit for 1d4 rounds due to divine aftershock. If the wielder is a Cleric of a rival god, they take 1d6 damage.;https://wiki.leagueoflegends.com/en-us/images/Sword_of_the_Divine_item.png
Legendary Marksman Item;ionia;Favored by temple archers, these items echo the teachings of precision and inner balance, principles deeply rooted in Ionian martial arts.;Grants bonus attack damage, attack speed, and critical strike chance, enhancing ranged damage output.;Ranged attacks gain +1 to hit and damage. On a critical hit, the target must save versus Wisdom or be stunned for one round, representing the perfect shot finding a pressure point.;https://wiki.leagueoflegends.com/en-us/images/Legendary_Marksman_Item_item.png
Guardian's Amulet;targon;Forged on the slopes of Mount Targon, rumored to offer protection against celestial wrath and the dangers of the ascent.;Provides health regeneration and damage reduction from champion attacks. Grants bonus movement speed when near an ally.;"Confers +1 to Saves vs. Spells and missile attacks. When within 30' of another character, gain +2 to movement; if damaged, both must Save vs. Paralysis or be unable to move for 1 round.";https://wiki.leagueoflegends.com/en-us/images/Guardian%27s_Amulet_item.png
Hextech Gunblade;noxus;A hybrid weapon favored by those who blend magic and might, like Viktor. Potentially once belonging to a Hemomancer for blood magic.;Deals magic damage, grants lifesteal and spell vamp, and active damage that slows the target.;"On Hit: 1d4+1 magic damage; Target is slowed, -2 to movement for 1 round; Heals wielder for damage dealt (cap 8hp/round).";https://wiki.leagueoflegends.com/en-us/images/Hextech_Gunblade_item.png
Rite of Ruin;noxus;May be connected to the Black Rose. Grants empowerments at the cost of health, a common theme in Noxian pacts.;Deals damage to yourself to deal damage to enemies, and gain movement speed.;"Sacrifice HP: deal +1d6 damage; Move with haste, +5' movement that round. 1 in 6 chance of attracting unwanted attention from dark entities.";https://wiki.leagueoflegends.com/en-us/images/Rite_of_Ruin_item.png
Wordless Promise;targon;Forged by a forgotten aspect of Targon, the Wordless Promise binds two champions, sharing their burdens and bolstering their resolve.;Grants bonus health and ability haste. Periodically heals your most wounded ally. Healing them grants you movement speed.;As an action, touch an ally to grant them temporary HP. If they are reduced to zero HP before your next turn, you may choose to take the damage instead, appearing adjacent to them.;https://wiki.leagueoflegends.com/en-us/images/Wordless_Promise_item.png
Alacrity;ionia;Favored by Ionian duelists seeking swiftness in combat. The enchanted boots whisper forgotten techniques, enhancing reflexes and agility.;Grants bonus movement speed. Passively grants bonus tenacity and slow resist.;"Wearer moves +2"" per round. Saving throws against being stunned or slowed gain +2. If the wearer fails the saving throw, they only suffer half of the duration/effect.";https://wiki.leagueoflegends.com/en-us/images/Alacrity_item.png
Arcane Sweeper;noxus;Favored by Noxian scouts, the device is rumored to have been reverse-engineered from ancient Shuriman surveillance technology.;Reveals and disables nearby wards and traps for a short duration. Grants movement speed towards revealed wards.;As an action, reveal hidden threats (DC 13 WIS save to resist). Grants +2 to move silently near revealed threats, but all others gain advantage to detect you.;https://wiki.leagueoflegends.com/en-us/images/Arcane_Sweeper_item.png
Atma's Impaler;demacia;Potentially used by Demacian soldiers. Grants resilience and damage based on fortitude, embodying Demacian ideals.;Grants attack damage based on max health. Provides bonus armor and magic resist.;Wearer gains +1 AC per 10 current HP. On a crit, deal +1d4 damage per 10 max HP. If reduced to 0 HP, wearer makes a DC 15 CON save, or is slain outright.;https://wiki.leagueoflegends.com/en-us/images/Atma%27s_Impaler_item.png
Avarice Blade;freljord;Likely tied to a Freljordian tribe known for raiding. The blade may have been used to plunder from rival tribes or outsiders.;Grants gold upon killing a unit and increased critical strike chance.;Upon a kill, wielder gains 1d4 silver pieces. Additionally, rolls of '1' on attack dice are rerolled, once per turn.;https://wiki.leagueoflegends.com/en-us/images/Avarice_Blade_item.png
Black Mist Scythe;shadow isles;Associated with the Black Mist emanating from the Shadow Isles, potentially used by those who seek to manipulate its power.;Grants gold and vision upon damaging enemy champions with abilities or attacks. Transforms into Harrowing Crescent.;"Upon striking a foe, 1d4 temporary HP are granted, and a spectral image is revealed. Once 5 images are seen, the scythe transforms; the wielder's max HP is permanently reduced by 1.";https://wiki.leagueoflegends.com/en-us/images/Black_Mist_Scythe_item.png
Blue Pill;demacia;Commonly used by mageseekers to quickly return to base after long missions, it is associated with Demacia's infrastructure and control.;Instantly restores mana and returns the champion to their base.;"Quaffing the blue pill allows immediate return to a designated safe haven. All accumulated wounds and fatigue are miraculously healed upon arrival. However, this escape route is one-way only; the character cannot return to their departure point.";https://wiki.leagueoflegends.com/en-us/images/Blue_Pill_item.png
Brawler's Gloves;ionia;Worn by pit fighters and martial artists across Ionia, these gloves are rumored to be blessed by a forgotten spirit of perseverance.;Grants critical strike chance. Useful for champions that rely on auto attacks.;Wearer’s attacks deal +1 damage and threaten a Critical Hit on a roll of 19-20. On a critical hit, deal double damage and inflict Broken status for 1 round.;https://wiki.leagueoflegends.com/en-us/images/Brawler%27s_Gloves_item.png
Caesura;noxus;Forged in the heart of the Noxian empire, it is rumored to have been wielded by a powerful warlord during the early expansions.;Grants a shield after dashing, and increased damage based on missing health.;When the wielder is brought low, they may call upon the blade's inherent power, granting them +4 to AC for 1d4 rounds. On a hit, the blade deals +1d6 damage for each point of AC granted.;https://wiki.leagueoflegends.com/en-us/images/Caesura_item.png
Celestial Eye;targon;Said to be crafted by long-lost seers from Mount Targon, this relic enhances one's ability to perceive hidden truths and foresee future events.;Provides vision and reveals invisible units in an area. Grants bonus ability power.;Confers +2 to WIS checks related to perception and divination. Once per day, grants a glimpse of a possible future, though its accuracy is suspect (50%).;https://wiki.leagueoflegends.com/en-us/images/Celestial_Eye_item.png
